{
  "$schema": "https://lumos.io/schemas/native-app-spec.v1.json",
  "version": 1,
  "summary": "Etsy 选品采集：用关键词爬 Etsy 商品列表（主图 + EHunt 插件全部指标）→ 用户勾选感兴趣的商品 → 爬这些商品详情页的所有详情图入图库。全程走浏览器爬取（复用 Lumos EHunt / web-research 能力），不调任何图片生成服务商、不烧 AI 配额。EHunt 指标依赖用户浏览器环境（AdsPower profile + 已装 EHunt 扩展 + 已登录 Etsy）。",
  "userVisibleScope": [
    "在「采集任务」页用关键词新建采集任务，点「立即爬」走浏览器抓 Etsy 搜索结果：每个商品拿主图 + 标题 + 价格 + EHunt 注入的销量/收藏/上架日期等指标，落到「商品列表」。",
    "在「商品列表」页看到爬到的商品卡（主图 + EHunt 数据），勾选感兴趣的，点「爬选中商品的详情图」走浏览器进每个商品详情页采集全部详情图。",
    "在「图库」页查看采集到的所有详情图（按商品/关键词分组），多选批量下载到本地。",
    "在「设置」页选采集用的浏览器上下文（内置 / AdsPower）、默认每次爬商品数、详情图是否下载到本地；并查看 EHunt 接入前提说明。",
    "在「运行结果」页查看每次列表采集 / 详情采集的批次记录：关键词、找到商品数、EHunt 命中数、采集详情图数、失败原因。",
    "EHunt 指标只有在 AdsPower 上下文 + 页面检测到 EHunt 时才有；缺 AdsPower / 缺扩展 / 未登录 Etsy / Browser Bridge 未连时，采集状态如实显示 not_adspower / no_ehunt / bridge_unavailable / needs_login，绝不用 mock 数据冒充。",
    "采集到的商品图仅作选品研究参考，应用不提供把它们直接上架到 Etsy/Shopify 的能力（避免 DMCA 侵权）。",
    "自动化页可开启「关键词采集巡更」，按调度对 enabled 的关键词任务定时跑列表采集。"
  ],
  "status": {
    "states": ["not_configured", "needs_auth", "ready", "syncing", "running", "failed", "not_connected"],
    "readyCriteria": [
      "应用页面可打开；设置页已选好采集用浏览器上下文。",
      "至少创建了一个关键词采集任务。",
      "Browser Bridge 已连接（Lumos 桌面浏览器运行时已启动）。",
      "一次列表采集能跑通：商品列表里出现至少 1 个带主图的商品。"
    ],
    "notConnectedBehavior": "Browser Bridge 未连时显示 not_connected 和「请确认 Lumos 桌面浏览器运行时已启动」；非 AdsPower 上下文 / 未装 EHunt 时商品的 ehunt_status 显示 not_adspower / no_ehunt（仍可拿主图，只是没 EHunt 指标）；Etsy 未登录时详情采集显示 needs_login。任何环节失败都显示真实 reason，绝不 mock。"
  },
  "settings": [
    { "id": "browser", "label": "采集浏览器", "fields": ["浏览器上下文（内置 / AdsPower）", "EHunt 接入前提说明"] },
    { "id": "collect", "label": "采集参数", "fields": ["默认每次爬商品数", "详情图是否下载到本地"] },
    { "id": "danger-zone", "label": "危险操作", "fields": ["清空图库", "清空商品列表"] },
    { "id": "advanced", "label": "高级（采集说明 / 风险边界）", "fields": ["采集说明 (ai_system_prompt)", "风险边界 (risk_note)"] }
  ],
  "data": {
    "entities": [
      "etsy_forge_collection_tasks",
      "etsy_forge_products",
      "etsy_forge_images",
      "etsy_forge_runs",
      "app_settings",
      "app_automations",
      "run_history",
      "assistant_messages",
      "app_notifications",
      "app_command_runs",
      "acceptance_checks"
    ],
    "reusableStores": ["settings", "run_history", "notifications", "command_runs"]
  },
  "ai": {
    "enabled": false,
    "promptSettings": true,
    "draftBeforeWrite": true,
    "visibleFailureHandling": true
  },
  "automations": {
    "enabled": true,
    "controls": ["enable", "pause", "run_now", "edit", "delete"],
    "visibleRunResults": true
  },
  "runResults": {
    "visible": true,
    "states": ["running", "success", "failed", "cancelled"],
    "failureReasons": true,
    "retry": true
  },
  "im": {
    "enabled": true,
    "lowRiskCommands": [
      "/etsy-forge status",
      "/etsy-forge runs",
      "/etsy-forge products",
      "/etsy-forge library"
    ],
    "confirmationRequiredFor": [
      "通过 IM 命令触发新一轮关键词采集（消耗浏览器抓取资源 / 可能触发 Etsy 反爬）",
      "通过 IM 命令批量爬详情图（必须在应用内确认勾选范围）",
      "通过 IM 命令清空图库 / 清空商品列表"
    ],
    "visibleCommandResults": true
  },
  "risk": {
    "writeActionsRequireConfirmation": true,
    "highRiskActions": [
      "清空全部图库（不可恢复）",
      "清空全部商品列表（不可恢复）",
      "对大量勾选商品批量爬详情图（耗时 + 可能触发 Etsy 反爬）"
    ],
    "outOfScope": [
      "把采集到的同行商品图直接上架到 Etsy / Shopify / Printful 售卖（DMCA 侵权，绝对禁止；采集图仅作选品研究参考）",
      "对采集到的同行图做二次创作再售卖（洗稿型二创，封店级风险）",
      "绕过 Etsy 反爬（自建 transaction-id / IP 池 / 模拟点击）",
      "为该应用单独修改 BrowserManager / 全局浏览器基础设施（必须走 browser-provider）",
      "Browser Bridge 未连 / 非 AdsPower / 未装 EHunt 时用 mock 数据冒充采集成功",
      "调用任何图片生成服务商烧 AI 配额（本应用是纯爬取工具，不生图）"
    ]
  },
  "acceptance": [
    { "id": "installation-self-check", "label": "安装自检", "howToVerify": "安装完成后查看安装自检结果，或在状态页点「重新运行安装自检」；通过或失败自动写入本验收项。" },
    { "id": "browser-bridge-ready", "label": "Browser Bridge 可用", "howToVerify": "状态页显示 Browser Bridge 连接状态；未连时显示 not_connected 和启动提示。" },
    { "id": "create-keyword-task", "label": "创建关键词任务", "howToVerify": "在采集任务页输入关键词新建任务，列表出现该任务，状态 idle。" },
    { "id": "list-collect", "label": "列表采集跑通（爬主图 + EHunt）", "howToVerify": "对一个关键词任务点「立即爬」，商品列表出现带主图的商品；AdsPower + EHunt 环境下 ehunt_status=ok 且能看到销量/收藏指标；非 AdsPower 时如实显示 not_adspower，仍有主图。" },
    { "id": "select-products", "label": "勾选商品", "howToVerify": "在商品列表勾选若干商品，selected 置位；可全选 / 清空。" },
    { "id": "detail-collect", "label": "详情图采集入库", "howToVerify": "对勾选商品点「爬选中商品的详情图」，走浏览器进详情页采集 galleryImageUrls 入 etsy_forge_images；商品 detail_status=success 且 detail_image_count>0；图库出现这些详情图。" },
    { "id": "ehunt-status-honest", "label": "EHunt 状态如实", "howToVerify": "在非 AdsPower 上下文采集，商品 ehunt_status 显示 not_adspower 且 ehunt 指标为空，不 mock；Browser Bridge 未连显示 bridge_unavailable。" },
    { "id": "library-download", "label": "图库下载", "howToVerify": "图库多选详情图 → 打包下载到本地。" },
    { "id": "no-image-gen", "label": "不调图片服务商", "howToVerify": "全流程（列表采集 + 详情采集）不产生任何图片生成服务商调用、不扣 AI 配额；余额不因采集变化。" },
    { "id": "danger-zone-confirm", "label": "危险操作二次确认", "howToVerify": "点「清空图库」「清空商品列表」必须弹二次确认，未确认不执行。" },
    { "id": "review-automations", "label": "查看自动化", "howToVerify": "自动化页能看到「关键词采集巡更」；可立即运行 / 暂停；结果写入 run_history。" },
    { "id": "review-im-commands", "label": "查看 IM 命令", "howToVerify": "通知命令页能看到 /etsy-forge status|runs|products|library；高风险命令（清空 / 批量爬）回到应用内确认。" },
    { "id": "review-run-history", "label": "查看运行结果", "howToVerify": "运行结果页能看到每次列表 / 详情采集批次：关键词、商品数、EHunt 命中数、详情图数、失败原因。" },
    { "id": "save-settings", "label": "保存设置", "howToVerify": "在设置页改采集浏览器 / 默认爬取数 / 详情图下载开关并保存，再次打开仍在。" }
  ]
}
